{
  "run_id": "p0-fixture-case-manifest",
  "case_name": "validated-baseline",
  "timestamp_utc": "2026-09-08T00:00:00+00:00",
  "git_sha": "0000000000000000000000000000000000000000",
  "app_version": "0.0.0",
  "dependency_lock_hash": "sha256:0000000000000000000000000000000000000000000000000000000000000000",
  "config_hash": "sha256:1111111111111111111111111111111111111111111111111111111111111111",
  "solver": {
    "name": "ipopt",
    "version": "unknown",
    "termination_condition": "not_yet_run"
  },
  "monte_carlo": {
    "n_samples": 2000,
    "distribution_assumptions_hash": "sha256:2222222222222222222222222222222222222222222222222222222222222222"
  },
  "wall_time_s": 0.0,
  "warnings": [
    "P0 hand-written fixture — proves the case-manifest schema and CI wiring only. No flowsheet/solver run exists yet; this is not a real case result. See docs/adr/0001-c0-feasibility-spike.md for solver-availability status."
  ],
  "kpis": {
    "purity_wt_pct": null,
    "recovery_pct": null,
    "tac_median_usd_per_yr": null
  }
}
